{
  "schema": "platformforge/observation/v1",
  "observation_id": "obs-aaaa000000000001",
  "collector": "kubernetes", "collector_version": "k8s-collector/0.3.0",
  "provider": "kubernetes", "source_type": "observed",
  "captured_at": "2025-06-01T00:00:00Z",
  "fresh_until": "2099-01-01T00:00:00Z",
  "scope": {"resource_types": ["k8s:apps/Deployment"]},
  "coverage": {"status": "complete"},
  "objects": [
    {"resource_id": "k8s://lab/prod/Deployment/api#uid1",
     "resource_type": "k8s:apps/Deployment",
     "provider": "kubernetes", "namespace": "prod", "name": "api",
     "uid": "uid1", "content_hash": "h-api-v1",
     "attributes": {"spec.replicas": 3}},
    {"resource_id": "k8s://lab/prod/Deployment/worker#uid2",
     "resource_type": "k8s:apps/Deployment",
     "provider": "kubernetes", "namespace": "prod", "name": "worker",
     "uid": "uid2", "content_hash": "h-worker-v1",
     "attributes": {"spec.replicas": 2}}
  ]
}
