{
  "schema": "platformforge/observation/v1",
  "observation_id": "obs-bbbb000000000002",
  "collector": "kubernetes", "collector_version": "k8s-collector/0.3.0",
  "provider": "kubernetes", "source_type": "observed",
  "captured_at": "2025-06-01T01:00:00Z",
  "fresh_until": "2099-01-01T00:00:00Z",
  "scope": {"resource_types": ["k8s:apps/Deployment"]},
  "coverage": {"status": "complete"},
  "objects": [
    {"resource_id": "k8s://lab/prod/Deployment/api#uid1",
     "resource_type": "k8s:apps/Deployment",
     "provider": "kubernetes", "namespace": "prod", "name": "api",
     "uid": "uid1", "content_hash": "h-api-v2",
     "attributes": {"spec.replicas": 2}},
    {"resource_id": "k8s://lab/prod/Deployment/rogue#uid9",
     "resource_type": "k8s:apps/Deployment",
     "provider": "kubernetes", "namespace": "prod", "name": "rogue",
     "uid": "uid9", "content_hash": "h-rogue",
     "attributes": {"spec.replicas": 1}}
  ]
}
